present,future
"Ich gehe bald zum Supermarkt und kaufe Kuchen und Getränke, denn bald feiere ich meinen Geburtstag. Meine Freunde kommen vorbei und wir spielen Gesellschaftsspiele, bevor wir den Kuchen essen und dann zu einer Bar am Bahnhof gehen. Dort feiern wir dann richtig.","Ich werde morgen zum Supermarkt gehen und Kuchen und Getränke kaufen, denn morgen werde ich meinen Geburtstag feiern. Meine Freunde werden vorbei kommen und wir werden Gesellschaftsspiele spielen, bevor wir den Kuchen essen werden und zu einer Bar am Bahnhof gehen werden. Dort werden wir dann richtig feiern."
Unsere Familie fährt nächsten Sommer nach Spanien in den Urlaub. Wir fahren nach Malaga und genießen die Sonne am Strand. Außerdem besichtigen wir die alte Kathedrale und besuchen an den Wochenenden den traditionellen Handwerksmarkt.,Unsere Familie wird nächsten Sommer nach Spanien in den Urlaub fahren. Wir werden nach Malaga fahren und die Sonne am Strand genießen. Außerdemwerden wir die alte Kathedrale besichtigen und an den Wochenenden den traditionellen Handwerksmarkt besuchen.
"Die deutsche Bahn investiert mittelfristig 35 Millionen Euro in den Ausbau der Nahverkerhsinfrastruktur in der Region Rheinland. Bald beginnt die erste Planungsphase für ein neues Verkehrswege Konzept, welches die bisherigen Strecken entlastet.","Die deutsche Bahn wird mittelfristig 35 Millionen Euro in den Ausbau der Nahverkerhsinfrastruktur in der Region Rheinland investieren. Bald wird die erste Planungsphase für ein neues Verkehrskonzeptbeginnen, welches die bisherigen Strecken entlasten wird , beginnen."
"Laborleiter Holger G. des econLab erwartet, dass bald alle Teilnehmer im Labor die Stifte  zurückbringen, die sie bei Experimenten versehentlich mitgenommen haben. Er schreibt zeitnah einen Aushang am schwarzen Brett des Labors.","Laborleiter Holger G. des econLab erwartet, dass bald alle Teilnehmer im Labor die Stifte  zurückbringen werden, die sie bei Experimenten versehentlich mitgenommen haben. Er wird zeitnah einen Aushang am schwarzen Brett des Labors schreiben."
"Wir feiern im Frühjahr ein Familienfest und laden Familie Becker ein. Familie Becker fährt auch in Frühjahrsurlaub, aber an diesem Wochenende haben sie Zeit. Darum denken wir, dass sie zum Frühlingsfest kommen. Dann grillen wir wieder richtig schön gemeinsam.","Wir feiern im Frühjahr ein Familienfest und werden Familie Becker einladen. Familie Becker wird auch in Frühjahrsurlaub fahren, aber an diesem Wochenende da sein. Darum denken wir, dass sie zum Frühlingsfest kommen werden. Dann werden wir wieder richtig schön grillen  gemeinsam."
